{
  "schema": "org.disked.handoff/1",
  "work_id": "DE-W030",
  "base_revision": "34583d15296d388bf4319e1c8e0b575d02db1f23",
  "spec_manifest_digest": "sha256:3391ac228460fa4667e598084299335767efdd7e31639d6b81ee42f7893f0eb9",
  "status": "partial",
  "files_read": [
    "AGENTS.md",
    "spec/START-HERE.md",
    "spec/index.md",
    "spec/work/units.json",
    "spec/catalog/nt-volume-namespace-prototype.json",
    "source/platform/windows/storage/volume_namespace.cpp",
    "source/providers/windows/volume_inventory.cpp",
    "source/platform/windows/storage/namespace_worker.cpp",
    "spec/catalog/nt-namespace-worker-prototype.json",
    "docs/windows-inventory.md",
    ".aide/evidence/2026-10-21-volume-namespace/expected.json",
    ".aide/evidence/2026-10-21-volume-namespace/control.py",
    ".aide/evidence/2026-10-21-volume-namespace/replay.py",
    "tests/windows/native/volume_native_probe.cpp",
    "tests/windows/native_volume_observations.py"
  ],
  "files_changed": [
    ".aide/evidence/2026-10-21-volume-namespace/capture/prepared.json.xz",
    ".aide/programmes/disked-0.1.0.json",
    "TODO.MD",
    "docs/development-plan.md",
    "docs/windows-inventory.md",
    "spec/catalog/input-dependencies.json",
    "spec/catalog/nt-volume-namespace-prototype.json",
    "spec/manifest.json",
    "spec/work/units.json",
    ".aide/evidence/2026-10-21-volume-namespace/REVIEW.md",
    ".aide/evidence/2026-10-21-volume-namespace/capture/cleanup-live.json",
    ".aide/evidence/2026-10-21-volume-namespace/capture/cleanup.json.xz",
    ".aide/evidence/2026-10-21-volume-namespace/capture/launch.json.xz",
    ".aide/evidence/2026-10-21-volume-namespace/capture/receipt.json.xz",
    ".aide/evidence/2026-10-21-volume-namespace/capture/replay.json",
    ".aide/evidence/2026-10-21-volume-namespace/capture/retained.tar.xz",
    ".aide/evidence/2026-10-21-volume-namespace/post-native.json.xz",
    ".aide/evidence/2026-10-21-volume-namespace/replay.py",
    ".aide/evidence/2026-10-21-volume-namespace/validation.json.xz",
    ".aide/handoffs/DE-W030-native-namespace-2026-10-21.json"
  ],
  "summary": "Agent-reviewed selected native guest namespace at34583d15:five actual volumes including independently known cap GUID/mount,six observer cases and16 owned execution-port calls. Exact raw/source/process/output/target identities replay. Original32MiB and ordinary restricted-worker controls pass;owned image/account/process/source cleanup independently verified. Corrected initial unstarted delivery failure and added pre-allocation transfer regressions. Full509 host tests pass with3 skips;current context/manifest pass. Product source unchanged;no current full product rerun,public/physical/XP/owner/full-unit/full0.1.0 admission. Earlier actual preparation/fix commits were pushed to dev;current qualified integration remains the next authorized Git action.",
  "tests": [
    {
      "command": "python -B tools/workspace.py run -- python -B .aide/evidence/2026-10-21-volume-namespace/launch.py",
      "cwd": "D:\\Projects\\DiskEd\\disked",
      "status": "pass",
      "exit_code": 0,
      "evidence_path": ".aide/evidence/2026-10-21-volume-namespace/capture/launch.json.xz"
    },
    {
      "command": "Managed253 specification,250 tooling and6 native-observation checker tests;3 documented skips",
      "cwd": "D:\\Projects\\DiskEd\\disked",
      "status": "pass",
      "exit_code": 0,
      "evidence_path": ".aide/evidence/2026-10-21-volume-namespace/validation.json.xz"
    },
    {
      "command": "Managed raw replay,manifest and current DE-W030 context generation/verification",
      "cwd": "D:\\Projects\\DiskEd\\disked",
      "status": "pass",
      "exit_code": 0,
      "evidence_path": ".aide/evidence/2026-10-21-volume-namespace/post-native.json.xz"
    },
    {
      "command": "Full native product suite,new Win32/XP/other-host/physical provider qualification",
      "cwd": "D:\\Projects\\DiskEd\\disked",
      "status": "not_run",
      "exit_code": null,
      "evidence_path": null
    }
  ],
  "artifacts": [
    {
      "path": ".aide/evidence/2026-10-21-volume-namespace/REVIEW.md",
      "sha256": "sha256:92f885818f73c7e5124edf34faaee63df3521376f4f9cd44f8d37f763543ed16"
    },
    {
      "path": ".aide/evidence/2026-10-21-volume-namespace/validation.json.xz",
      "sha256": "sha256:a84bb22c3e9b1aace62ef0e095a7471acaa09157ed91fd4c4c8b2f9a45060cfa"
    },
    {
      "path": ".aide/evidence/2026-10-21-volume-namespace/post-native.json.xz",
      "sha256": "sha256:94d310009223770d3f8a3906285b1d34460dc454cf8ef644bfcdb9576e6c21cc"
    },
    {
      "path": ".aide/evidence/2026-10-21-volume-namespace/capture/replay.json",
      "sha256": "sha256:3d42967f23807cd68e53dccae4b4ace990cb1b370836d796d150932eb2a98627"
    },
    {
      "path": ".aide/evidence/2026-10-21-volume-namespace/capture/receipt.json.xz",
      "sha256": "sha256:830072aceec13a5a5d98a33b2aafc95d29dc73e1a16e563135a1247a0d9111d8"
    },
    {
      "path": ".aide/evidence/2026-10-21-volume-namespace/capture/retained.tar.xz",
      "sha256": "sha256:9552d5feff5b15112c514f3fc676d182abcf32e397a2cb9d420c7f64b98fb1e3"
    },
    {
      "path": ".aide/evidence/2026-10-21-volume-namespace/capture/cleanup-live.json",
      "sha256": "sha256:6e5adc1b45e955e6344651e771de0ac9b6717db11f752c6aa6d7fba3c83114b5"
    },
    {
      "path": ".aide/evidence/2026-10-21-volume-namespace/bootstrap-f46b536c/retirement-unstarted.json",
      "sha256": "sha256:f7abb6421b4fbfe13c0c8b78da5541338ab8df2017890aa56a003cd15f4d4be6"
    }
  ],
  "blockers": [],
  "next_safe_step": "Define and qualify a distinct compiled native namespace mode through the existing contained worker and typed inventory path under DE-W030. Preserve current fixture-only guards and exact source/request/capture/worker bindings;do not merely accept native pointers in the injected role. Reuse the proven ordinary guest and capped profile as needed. Require explicit dispatch,finite observation waits,actual exit/cleanup and exact known-volume evidence before public provider admission. Product startup,raw device/writer/elevation/customer/install/release and XP/other-host gates remain separate. Continue original all-platform/storage0.1.0.",
  "performed_remote_writes": true
}
